{
  "eventId": "evt-contract-001",
  "tenantId": "factory-01",
  "eventType": "telemetry.anomaly",
  "timestamp": "2026-10-24T12:00:00Z",
  "source": "telemetry-processor",
  "version": "1.0",
  "payload": {
    "deviceId": null,
    "metric": null,
    "value": null
  },
  "severity": "CRITICAL",
  "reasons": [
    "missing deviceId, metric or value"
  ],
  "detectedAt": "2026-10-24T12:00:01Z"
}
