{
  "eventId": "evt-contract-001",
  "tenantId": "factory-01",
  "eventType": "telemetry.anomaly",
  "timestamp": "2026-10-24T12:00:00Z",
  "source": "telemetry-processor",
  "version": "1.0",
  "payload": {
    "deviceId": "sensor-1042",
    "deviceType": "temperature-sensor",
    "metric": "temperature",
    "value": 95,
    "unit": "C",
    "location": "zone-a"
  },
  "severity": "WARNING",
  "reasons": [
    "temperature is above maximum threshold"
  ],
  "detectedAt": "2026-10-24T12:00:01Z"
}
